{
  "schema_version": "1.0.0",
  "repository": "wfprieto/World-Class-SEO-Agent-System",
  "scope": "STATIC_REPOSITORY_OPERATIONS",
  "critical_paths": [
    {
      "id": "architecture-quality-debt",
      "title": "Retire bounded architecture exceptions",
      "status": "READY",
      "owner": "Repository maintainer",
      "backup_status": "OWNER_ACTION_REQUIRED",
      "issue": {
        "number": 26,
        "url": "https://github.com/wfprieto/World-Class-SEO-Agent-System/issues/26",
        "expected_state": "CLOSED"
      },
      "runbook": {"path": "docs/REPOSITORY-OPERATIONS.md", "anchor": "ops-architecture-quality-debt"},
      "verification": ["python scripts/validate_architecture_exception_disposition.py"],
      "metric": "Unretired bounded architecture exceptions",
      "threshold": "No new exception and every retained exception has exact issue-backed disposition",
      "rollback_trigger": "An exception is removed without passing its recorded retirement criteria.",
      "rollback_procedure": "Restore the last valid disposition and reopen issue #26 before merge.",
      "next_action_due": "2027-01-31",
      "closure_evidence": {"status": "NOT_REQUIRED", "refs": []},
      "blocker": null
    },
    {
      "id": "repository-governance",
      "title": "Maintain solo-owner protected-branch controls",
      "status": "READY",
      "owner": "Repository maintainer",
      "backup_status": "OWNER_ACTION_REQUIRED",
      "issue": {
        "number": 27,
        "url": "https://github.com/wfprieto/World-Class-SEO-Agent-System/issues/27",
        "expected_state": "CLOSED"
      },
      "runbook": {"path": "docs/REPOSITORY-OPERATIONS.md", "anchor": "ops-repository-governance"},
      "verification": ["python scripts/validate_repository_governance.py"],
      "metric": "Provider-verified required certification and unresolved-thread enforcement",
      "threshold": "Zero impossible human approvals; exact-head repository-certification, resolved threads, squash-only merge, and linear history remain enforced",
      "rollback_trigger": "Required certification, thread resolution, squash-only merge, linear history, deletion protection, or force-push protection weakens.",
      "rollback_procedure": "Restore the versioned solo-maintainer ruleset contract and reopen issue #27 before another merge.",
      "next_action_due": "2026-11-29",
      "closure_evidence": {"status": "VERIFIED", "refs": ["https://github.com/wfprieto/World-Class-SEO-Agent-System/pull/24", "https://github.com/wfprieto/World-Class-SEO-Agent-System/rules/18955880"]},
      "blocker": null
    },
    {
      "id": "network-provider-boundaries",
      "title": "Resolve code-verifiable comparative capability gaps",
      "status": "READY",
      "owner": "Repository maintainer",
      "backup_status": "OWNER_ACTION_REQUIRED",
      "issue": {
        "number": 28,
        "url": "https://github.com/wfprieto/World-Class-SEO-Agent-System/issues/28",
        "expected_state": "CLOSED"
      },
      "runbook": {"path": "docs/REPOSITORY-OPERATIONS.md", "anchor": "ops-network-provider-boundaries"},
      "verification": ["python scripts/validate_product_contract.py", "python scripts/validate_capability_certification.py"],
      "metric": "Comparative capability claims without executable evidence",
      "threshold": "Zero unsupported material comparative claims",
      "rollback_trigger": "A comparative claim exceeds the capability represented by executable repository evidence.",
      "rollback_procedure": "Revert the unsupported claim or capability change and reopen issue #28.",
      "next_action_due": "2027-01-31",
      "closure_evidence": {"status": "NOT_REQUIRED", "refs": []},
      "blocker": null
    },
    {
      "id": "documentation-knowledge-truth",
      "title": "Keep knowledge, dependencies, and governance evidence current",
      "status": "READY",
      "owner": "Repository maintainer",
      "backup_status": "OWNER_ACTION_REQUIRED",
      "issue": {
        "number": 29,
        "url": "https://github.com/wfprieto/World-Class-SEO-Agent-System/issues/29",
        "expected_state": "CLOSED"
      },
      "runbook": {"path": "docs/REPOSITORY-OPERATIONS.md", "anchor": "ops-documentation-knowledge-truth"},
      "verification": ["python scripts/validate_repository_governance.py"],
      "metric": "Overdue knowledge, dependency, or governance evidence",
      "threshold": "Zero overdue repository-controlled freshness obligations",
      "rollback_trigger": "A freshness, dependency, or governance check regresses after maintenance.",
      "rollback_procedure": "Revert the maintenance change, preserve the failing evidence, and reopen issue #29.",
      "next_action_due": "2026-11-29",
      "closure_evidence": {"status": "NOT_REQUIRED", "refs": []},
      "blocker": null
    },
    {
      "id": "security-intake",
      "title": "Provide a monitored private conduct-reporting channel",
      "status": "READY",
      "owner": "Repository maintainer",
      "backup_status": "OWNER_ACTION_REQUIRED",
      "issue": {
        "number": 30,
        "url": "https://github.com/wfprieto/World-Class-SEO-Agent-System/issues/30",
        "expected_state": "CLOSED"
      },
      "runbook": {"path": "docs/REPOSITORY-OPERATIONS.md", "anchor": "ops-security-intake"},
      "verification": ["python scripts/validate_repository_operations.py", "python scripts/validate_private_conduct_intake.py"],
      "metric": "Attested monitored private conduct-reporting destinations",
      "threshold": "Exactly one documented and monitored private destination",
      "rollback_trigger": "The private destination becomes public, unmonitored, or inaccessible.",
      "rollback_procedure": "Mark the control blocked, remove the invalid destination, and reopen issue #30.",
      "next_action_due": "2027-01-31",
      "closure_evidence": {"status": "VERIFIED", "refs": ["gmail-profile-sha256:cffaef28ce43210066ebf9dbbe3f5922091a22c253d7035c423a7c7dedd43395"]},
      "blocker": null
    },
    {
      "id": "certification-supply-chain",
      "title": "Maintain incident, recovery, and rollback runbooks",
      "status": "READY",
      "owner": "Repository maintainer",
      "backup_status": "OWNER_ACTION_REQUIRED",
      "issue": {
        "number": 31,
        "url": "https://github.com/wfprieto/World-Class-SEO-Agent-System/issues/31",
        "expected_state": "CLOSED"
      },
      "runbook": {"path": "docs/REPOSITORY-OPERATIONS.md", "anchor": "ops-certification-supply-chain"},
      "verification": ["pwsh -File scripts/validate-repository.ps1"],
      "metric": "Critical operational paths without rehearsable recovery guidance",
      "threshold": "Zero uncovered critical paths",
      "rollback_trigger": "A documented recovery action is destructive, incomplete, or cannot restore the last good state.",
      "rollback_procedure": "Revert the runbook change and keep issue #31 open until a safe recovery rehearsal passes.",
      "next_action_due": "2026-11-29",
      "closure_evidence": {"status": "NOT_REQUIRED", "refs": []},
      "blocker": null
    },
    {
      "id": "runtime-evidence-integrity",
      "title": "Keep integrated certification and governance metrics enforceable",
      "status": "READY",
      "owner": "Repository maintainer",
      "backup_status": "OWNER_ACTION_REQUIRED",
      "issue": {
        "number": 32,
        "url": "https://github.com/wfprieto/World-Class-SEO-Agent-System/issues/32",
        "expected_state": "CLOSED"
      },
      "runbook": {"path": "docs/REPOSITORY-OPERATIONS.md", "anchor": "ops-runtime-evidence-integrity"},
      "verification": ["python scripts/validate_repository_operations.py"],
      "metric": "Required certification paths bypassed or non-reproducible",
      "threshold": "Zero bypassed required paths at the exact reviewed commit",
      "rollback_trigger": "A required certification path is bypassed or its evidence becomes non-reproducible.",
      "rollback_procedure": "Restore the last passing certification contract and reopen issue #32.",
      "next_action_due": "2026-11-29",
      "closure_evidence": {"status": "NOT_REQUIRED", "refs": []},
      "blocker": null
    }
  ]
}
